model,empirical_dataset,data_status,comparison_type,RMSE,MAE,R2,chi_square,AIC,BIC,baseline_model,limitations,classification,diagnosis,implemented_improvements,deferred_improvements
elastic_dubler_effect,redshift_clock,cached,redshift benchmark comparison,0.00923094413395547,0.00895960694857892,0.9996591548038047,405133141.38148963,-14.740775772248174,-17.354481411128283,published_or_fixture_baseline_shift,Small benchmark comparison only,empirical_comparison,"Small-sample benchmark with strong residual fit, but unit/sign interpretation and baseline provenance remain the main risks.","Explicit sign-convention metadata, bounded fit metadata, residual diagnostics, and report-level formula documentation.",Additional holdout analysis is not meaningful with only two benchmark rows.
locality_driven_gravity,galaxy_rotation,fetched,rotation-curve comparison,0.13259613742295692,0.09756297665399527,0.5594047329670517,4882.953546977945,-274.94441569201484,-256.7310867398864,multi_galaxy_baseline_family,Not a full astrophysical interpretation,empirical_comparison,"The main weakness is observable mapping and parameter regime selection, not raw data availability. Rotation-curve proxy quality depends strongly on radial binning and bounded parameter sweeps.","Tangential-velocity extraction, bounded deterministic parameter sweep, simple baseline family, and morphology diagnostics.",Full multi-galaxy catalog support and stronger astrophysical calibration remain future work.
black_hole_dynamics,eht_observables,cached,horizon/shadow proxy comparison,0.4112144395934495,0.3676233888493883,0.9988910333419617,0.13411303381798323,-3.109123597713289,-4.336534875473507,none,Published summary observables only,empirical_comparison,The limiting factor is summary-observable mapping and angular scaling rather than missing raw imaging products. Shared-scale fits remain coarse; per-source scaling is diagnostic only.,"Threshold-crossing proxy audit, weighted residuals, shared-scale vs per-source diagnostics, and residual plots.",No GRMHD image reconstruction or instrument forward model is included.
black_hole_dynamics,ligo_waveforms,fetched,memory-trace comparison,0.4206216300949059,0.345753407128193,0.0014652065108782253,26.102142553291383,-110.58280673596282,-108.40841946606719,none,Memory proxy uses waveform-style comparison data,empirical_comparison,"Observer-memory proxy alignment remains weak. The main issue is model sufficiency relative to waveform morphology, not dataset access.",Residual-envelope diagnostics and clearer weak-fit documentation.,A richer waveform-adapter family would be needed for stronger proxy alignment.
elastic_pi_ripples,ligo_ringdown,fetched,ringdown residual comparison,0.40345995944356666,0.3336654774973396,0.05706782488127038,21.028008042184954,-87.4752953399099,-71.13088519723351,damped_sinusoid_baseline,Finite toy-model ringdown comparison only,empirical_comparison,Ringdown alignment is limited by proxy projection quality and short noisy segment selection. The baseline remains competitive or better under the same window.,"Window alignment, raw/normalized strain columns, bounded TNE projection search, holdout diagnostics, and residual-envelope outputs.",A stronger reduced-order TNE waveform family would be required to outperform the damped-sinusoid baseline consistently.
